{"$schema":"https://json-schema.org/draft/2020-12/schema","additionalProperties":false,"properties":{"identity":{"additionalProperties":false,"properties":{"probe_revision":{"const":"blizzard.layout.0.1"},"report_id":{"type":"string"},"status":{"const":"layout_observed_pending_review"}},"required":["report_id","probe_revision","status"],"type":"object"},"integrity":{"additionalProperties":false,"properties":{"hash_algorithm":{"const":"sha256"},"report_sha256":{"pattern":"^[0-9a-f]{64}$","type":"string"}},"required":["hash_algorithm","report_sha256"],"type":"object"},"layout":{"additionalProperties":false,"properties":{"attribute_names":{"type":"array"},"edges":{"type":"array"},"hazards":{"type":"object"},"max_depth":{"minimum":1,"type":"integer"},"node_count":{"minimum":1,"type":"integer"},"tags":{"type":"array"}},"required":["tags","edges","attribute_names","node_count","max_depth","hazards"],"type":"object"},"schema_version":{"const":"0.1"},"source":{"additionalProperties":false,"properties":{"byte_count":{"minimum":1,"type":"integer"},"content_sha256":{"pattern":"^[0-9a-f]{64}$","type":"string"},"receipt_id":{"type":"string"},"receipt_sha256":{"pattern":"^[0-9a-f]{64}$","type":"string"}},"required":["receipt_id","receipt_sha256","content_sha256","byte_count"],"type":"object"}},"required":["schema_version","identity","source","layout","integrity"],"type":"object"}
