{"identity":{"probe_revision":"blizzard.layout.0.1","report_id":"synthetic.layout.report.001","status":"layout_observed_pending_review"},"integrity":{"hash_algorithm":"sha256","report_sha256":"345298be6c063a01855eaa4b4bf1376995c896cb9072126ed03b820e635b9c40"},"layout":{"attribute_names":[{"count":1,"name":"class","tag":"article"},{"count":1,"name":"data-view","tag":"body"},{"count":1,"name":"lang","tag":"html"},{"count":1,"name":"data-change","tag":"li"},{"count":1,"name":"id","tag":"main"},{"count":1,"name":"type","tag":"script"}],"edges":[{"child":"h2","count":1,"parent":"article"},{"child":"ul","count":1,"parent":"article"},{"child":"main","count":1,"parent":"body"},{"child":"script","count":1,"parent":"head"},{"child":"style","count":1,"parent":"head"},{"child":"body","count":1,"parent":"html"},{"child":"head","count":1,"parent":"html"},{"child":"article","count":1,"parent":"main"},{"child":"li","count":1,"parent":"ul"}],"hazards":{"comments":true,"declarations":true,"embedded_json":true,"scripts":true,"styles":true},"max_depth":6,"node_count":10,"tags":[{"count":1,"name":"article"},{"count":1,"name":"body"},{"count":1,"name":"h2"},{"count":1,"name":"head"},{"count":1,"name":"html"},{"count":1,"name":"li"},{"count":1,"name":"main"},{"count":1,"name":"script"},{"count":1,"name":"style"},{"count":1,"name":"ul"}]},"schema_version":"0.1","source":{"byte_count":352,"content_sha256":"e845400242b06bfe4e1b3f27ce42da903f9920f400531855cdebac5a05f27432","receipt_id":"synthetic.layout.receipt.001","receipt_sha256":"2a57ee2c652bd7d8fce900af401fab8a49f14470c4e195c02b2440aa92d554c6"}}
